{
  "schema_version": "project-config-v1",
  "project_id": "replace_with_project_id",
  "created_at": "2026-07-03T00:00:00+08:00",
  "project_kind": "reference_reverse_editing",
  "reference_video_source": {
    "source_type": "local_file",
    "path_or_url": "source/reference_original.mp4",
    "source_store_type": "replace_with_reference_category",
    "copy_reference_text_allowed": false
  },
  "target": {
    "target_store_type": "replace_with_target_store_type",
    "target_store_profile": {
      "store_name": null,
      "city_or_area": null,
      "signature_products": [],
      "people_roles": [],
      "shooting_constraints": []
    },
    "account_fields_status": "unknown_placeholder"
  },
  "output_goal": "shooting_preview_and_jianying_draft",
  "manual_review_required": true,
  "directory_layout": [
    "source",
    "analysis",
    "planning_same_structure",
    "content",
    "subtitles",
    "audio",
    "review_same_structure",
    "previs_same_structure",
    "jianying_template",
    "generation_workflow",
    "quality",
    "reports"
  ],
  "required_artifacts": [
    "shot_index.reviewed.json",
    "copy_script.json",
    "voiceover_script.json",
    "subtitle_track.json",
    "word_timestamps.json",
    "audio_mix_plan.json",
    "storyboard",
    "preview",
    "jianying_manifest",
    "acceptance_report"
  ],
  "jianying": {
    "seed_strategy": "seed_clone_slot_replacement",
    "seed_draft_path": null,
    "current_preview_draft_path": null,
    "modify_existing_draft_allowed": false
  },
  "generation_policy": {
    "remote_video_generation_allowed": false,
    "libtv_allowed_by_default": false,
    "tts_allowed_by_default": false,
    "dirty_subtitle_qc_required": true
  },
  "acceptance_checks": [
    {
      "check_id": "project_id_isolated",
      "description": "Project uses an isolated outputs/{project_id}/ directory.",
      "required": true,
      "status": "pending"
    },
    {
      "check_id": "shot_index_reviewed_exists",
      "description": "Reviewed shot index exists and is the downstream timing source.",
      "required": true,
      "status": "pending"
    },
    {
      "check_id": "content_layer_editable",
      "description": "Copy, voiceover, subtitles, word timestamps, and audio mix plan exist as editable files.",
      "required": true,
      "status": "pending"
    },
    {
      "check_id": "dirty_subtitle_qc_done",
      "description": "Generated or preview media has dirty-subtitle QC before being treated as publishable.",
      "required": true,
      "status": "pending"
    }
  ],
  "status_lifecycle": {
    "analysis_done": false,
    "content_layer_done": false,
    "previs_done": false,
    "jianying_template_done": false,
    "ai_preview_done": false,
    "real_material_done": false,
    "export_done": false
  }
}
